{
  "schema": "searchbridge.provider-policy-ledger/v1",
  "reviewed_at": "2026-09-04",
  "review_by": "2027-03-04",
  "providers": [
    {"id":"google-search-console","support_tier":"stable-live","cost_boundary":"existing API quota only; no billing change","automation":"bounded read-only scheduled qualification","max_cache_age_seconds":86400,"fixture_provenance":"synthetic","policy_sources":["https://developers.google.com/webmaster-tools/limits","https://developers.google.com/webmaster-tools/v1/searchanalytics/query","https://developers.google.com/webmaster-tools/v1/urlInspection.index/inspect"],"required_evidence":["search-analytics:success","search-analytics:empty","search-analytics:invalid-credential","inspect-url:success","inspect-url:invalid-credential"],"live_evidence":[]},
    {"id":"google-analytics-4","support_tier":"stable-live","cost_boundary":"standard-property Data API quota only; no Analytics 360 dependency","automation":"bounded read-only scheduled qualification","max_cache_age_seconds":86400,"fixture_provenance":"synthetic","policy_sources":["https://developers.google.com/analytics/devguides/reporting/data/v1/quotas","https://developers.google.com/analytics/devguides/reporting/data/v1/rest/v1beta/properties/runReport"],"required_evidence":["run-report:success","run-report:empty","run-report:invalid-credential"],"live_evidence":[]},
    {"id":"pagespeed-insights","support_tier":"stable-live","cost_boundary":"keyless or existing restricted quota only; no metered service","automation":"bounded read-only scheduled qualification","max_cache_age_seconds":86400,"fixture_provenance":"synthetic","policy_sources":["https://developers.google.com/speed/docs/insights/v5/get-started","https://developers.google.com/speed/docs/insights/v5/reference/pagespeedapi/runpagespeed"],"required_evidence":["run-pagespeed:mobile:success","run-pagespeed:desktop:success","run-pagespeed:invalid-credential"],"live_evidence":[]},
    {"id":"crux","support_tier":"stable-live","cost_boundary":"existing no-charge API quota only","automation":"bounded read-only scheduled qualification","max_cache_age_seconds":86400,"fixture_provenance":"synthetic","policy_sources":["https://developer.chrome.com/docs/crux/api"],"required_evidence":["query-record:PHONE:success","query-record:DESKTOP:success","query-record:TABLET:success","query-record:empty","query-record:invalid-credential"],"live_evidence":[]},
    {"id":"cloudflare","support_tier":"fixture-only","cost_boundary":"existing account plan entitlements only; no upgrade","automation":"disabled until dataset and fields are proven on the existing plan","max_cache_age_seconds":86400,"fixture_provenance":"synthetic","policy_sources":["https://developers.cloudflare.com/analytics/graphql-api/limits/","https://developers.cloudflare.com/analytics/graphql-api/getting-started/authentication/api-token-auth/"],"required_evidence":["http-requests:success","http-requests:empty","http-requests:invalid-credential"],"live_evidence":[]},
    {"id":"indexnow","support_tier":"fixture-only","cost_boundary":"operator-owned host only; no paid provider account","automation":"manual controlled submission only after explicit approval","max_cache_age_seconds":0,"fixture_provenance":"synthetic","policy_sources":["https://www.indexnow.org/documentation"],"required_evidence":["submit-urls:approved-success"],"live_evidence":[]},
    {"id":"bing-webmaster","support_tier":"fixture-only","cost_boundary":"excluded from no-extra-cost v1 live qualification","automation":"disabled","max_cache_age_seconds":86400,"fixture_provenance":"synthetic","policy_sources":["https://learn.microsoft.com/en-us/bingwebmaster/getting-access"],"required_evidence":[],"live_evidence":[]},
    {"id":"ahrefs","support_tier":"fixture-only","cost_boundary":"paid units prohibited for v1 qualification","automation":"disabled","max_cache_age_seconds":86400,"fixture_provenance":"synthetic","policy_sources":["https://docs.ahrefs.com/docs/api/reference/introduction"],"required_evidence":[],"live_evidence":[]},
    {"id":"dataforseo","support_tier":"fixture-only","cost_boundary":"metered calls prohibited for v1 qualification","automation":"disabled","max_cache_age_seconds":86400,"fixture_provenance":"synthetic","policy_sources":["https://docs.dataforseo.com/v3/serp/google/organic/overview/"],"required_evidence":[],"live_evidence":[]},
    {"id":"serpapi","support_tier":"fixture-only","cost_boundary":"metered calls prohibited for v1 qualification","automation":"disabled","max_cache_age_seconds":86400,"fixture_provenance":"synthetic","policy_sources":["https://serpapi.com/search-api"],"required_evidence":[],"live_evidence":[]},
    {"id":"plausible","support_tier":"external-reference","cost_boundary":"operator entitlement only; not a stable built-in","automation":"disabled","max_cache_age_seconds":86400,"fixture_provenance":"synthetic","policy_sources":["https://plausible.io/docs/stats-api"],"required_evidence":[],"live_evidence":[]},
    {"id":"semrush","support_tier":"disabled","cost_boundary":"commercial and redistribution approval required","automation":"disabled","max_cache_age_seconds":2592000,"fixture_provenance":"synthetic","policy_sources":["https://developer.semrush.com/api/"],"required_evidence":[],"live_evidence":[]}
  ]
}
